과,하는일
장애인복지과,"- 장애인 단체 운영 지원 및 요구사항 처리,- 장애인의 날 기념식(유공자 표창, 복지박람회 등)총괄,- 장애인전동보장구 보험 가입 사업,- 시각장애인 현장해설 지원,- 서울점자도서관 운영 지원,- 청각장애인 디지털 교실 운영 지원,- 유형별 중증 장애인 실태조사,- 장애인체육회 운영 지원,- 장애인 전동휠체어 연습장 조성 및 운영,- 장애인 이동기기 수리비 지원,- 장애인 이동기기 급속충전기 설치 및 유지보수 관리,- 장애인 전동보장구 소독기 설치 및 유지보수 관리,- 장애인 복지기금(공모사업) 및 장애인복지위원회 운영,- 장애인 친화미용실 조성 및 운영(1,2호점),- 장애인지원센터 디딤돌 운영 지원 업무,- 장애인 가족지원센터 운영 지원,- 장애인 실종예방사업,- 장애인 건강문화복합센터 조성,- 장애인정책협의회, 장애인친화도시 모니터링단,,장애인 친화도시 자문위원회 운영,- 장애인친화도시 신규사업 검토 및 현안사항 처리,- 장애인 편의증진기술지원센터 관리·운영,- 장애인 편의시설 관련 업무,- 시각장애인보행환경개선 업무,- 장애인식개선 및 홍보 사업,(직원교육, 사회적인식개선, 장애인보조견 인식개선 등),- 장애인 보완대체의사소통(AAC) 설치 추진,- 장애인전용주차구역 주차위반 단속(노원구 전역),- 장애인 이동 편의 지원(바우처 택시 관련 업무),- 구청사 내 장애인 민원 안내 키오스크 관리,- 장애인 일자리지원센터 운영 지원,- 장애인 자립생활센터 및 자립생활주택•지원주택 지원,- 장애인 등록업무 관련(진단검사비, 행정심판소송, 자격확인 등),- 장애인복지사업 평가 관련,- 장애인 인턴제 공모사업,- 장애인 연금·수당 등 복지급여,- 장애인사용자동차표지 관리 및 부당사용 과태료 부과,- 시청각 장애인 TV 지원사업,- 장애인 보조기기 교부사업,- 저소득 중증(심한) 장애인 유료방송 이용요금 지원,- 발달장애인 성년후견 심사 청구,7. 장애인 의료비 지원,8. 청각장애인 인공달팽이관 수술 및 재활 지원,- 장애인활동지원(중계동, 하계동),- 장애인활동지원 예산, 제공기관, 수급자격심의위원회 관리,- 장애인활동지원 시간선택제임기제 관리,- 중증장애인 응급안전알림서비스,- 장애인 야간순회방문서비스,노원구장애인일자리지원센터 업무 총괄,* 구직장애인 상담 및 알선,* 민간 사업체 개발 및 관리,* 장애인일자리지원센터 실적 D/B 관리,* 장애인유관기관 네트워크 실무자 간담회,* 노원구 장애인 채용박람회,* 장애인 공공일자리사업,* 장애인취업 안내서 매뉴얼 제작,1. 구직장애인 상담 및 알선,2. 센터 홈페이지 및 SNS채널 운영 및 관리,3. 개인정보관리(위수탁 계약 관리 및 운영 점검),4. 발달장애인 보호자 교육 지원,5. 사업체 개발 및 관리,*구직장애인 상담 및 알선(발달,정신),*민간 사업체 개발 및 관리,*공유서가 및 녹색환경 가꾸미 사업 지원,*발달장애인카페(디앤디)지원,*장애인 취업관련 직무교육, 인권교육 지원,- 장애인복지시설 지도·감독 및 인권감독관,- 장애인복지관, 수어통역센터, 장애인체육시설 운영 및 기능보강 지원,- 장애인복지관 연계 사업 지원,- 장애인복지시설 지도점검 및 안전점검 총괄,- 장애인복지시설 현장방문 총괄,- 장애인복지시설 종사자 지원 사업 총괄,- 장애인거주시설 운영 및 기능보강 지원,- 장애인거주시설 인권지킴이단 운영관리 및 인권업무 총괄,- 장애인거주시설 지도점검(안전점검 포함) 및 신고‧수리,- 장애인사회복지법인 관리 및 지도 감독,- 장애인복지시설 종사자 인권교육 및 회계교육 실시,- 코로나19 관련 장애인복지시설 총괄(방역물품 관리 등),- 구립 장애인주간보호시설(제2평교) 사업 추진,- 뇌병변장애인 비전센터 사업 추진,- 발달장애인평생교육센터 운영 및 기능보강 지원,- 장애인주간보호시설 운영 및 기능보강 지원,- 장애인주간보호시설 및 발달장애인평생교육센터 지도점검,(안전점검 포함) 및 신고‧수리"
,
여성가족과,"·여성.보육정책 인센티브 사업 총괄,·여성정책 계획 및 수립,·여성안심마을 공모사업,·여성안심귀가 스카우트 사업 지원,·여성안심귀갓길 운영,·여성단체연합회 운영 및 워크숍 추진,·비영리 민간단체보조금 지원사업(여성단체연합회),·양성평등주간행사 운영,·폭력피해지원시설 운영 지원,·성희롱 등 4대폭력예방교육 운영,·성폭력, 가정폭력 피해자, 일본군 피해자 지원,·24시간 종합안전서비스 ‘안심이’ 운영,·불법촬영시민감시단 운영,·안심사업 시설물 관리(택배함, 지킴이집),·가족친화인증 사업,·양성평등정책 계획 수립 및 시행,·양성평등위원회 운영 지원,·양성평등기금운용 및 심의회 운영,·성별영향평가 사업,·성인지 및 양성평등교육 운영,·비영리 민간단체보조금 지원사업(적십자),·지역사회보장협의체 여성분과,· 어린이복합문화시설 '점프' 건립 관련 업무,· 어린이집 그린리모델링 사업(공사, 준공식),· 공동육아방 설치(개관식),· 어린이날 축제 총괄,· 기타 타직원에 속하지 않은 업무,· 국공립어린이집 확충·변경(폐지) 및 재위탁,· 국공립어린이집 시설 및 운영·관리,- 화재안전,내진보강,기능보강,정원관리,환경개선비 등,· 보육정책위원회 운영 및 관리,· 보육행정 행사(어린이날, 탈축제 등),· 노원안심어린이집 선정 및 운영,(전연령 확대 및 모니터링),· 어린이집 지도점검 및 행정처분(상계9동),· 육아종합지원센터 관리 및 운영,· 어린이집 한마음 체육대회,· 어린이집 평가제 관리 및 지도점검 총괄,· 어린이집 지도점검 및 행정처분(공릉),· 보육인의 날,· 어린이집 간담회 및 원장 연수, 원장 교육,· 어린이집 보육교직원 연수지원,· 국공립어린이집연합회 지원,· 어린이집 지도점검 및 행정처분(중계,하계,상10),· 서울형, 모아어린이집 운영,· 부모모니터링단 업무,· 어린이집 보육교직원 보수교육 및 누리교육,· 민간어린이집 연합회 지원,· 어린이집 지도점검 및 행정처분(월계,상8),· 열린어린이집 관련 업무,· 어린이집 안전 및 시설 관리(중대재해, 감염병),· 민간, 가정어린이집 석면관리(탄소중립),· 어린이집 회계관리시스템 관리,· 가정어린이집 연합회 지원,· 시간선택제임기제 급여, 공공근로 등등,· 어린이집 지도점검 및 행정처분(상1~6,7),· 공동육아방 운영 관리 및 키즈카페 관련,· 육아종합지원센터 위탁 사업 운영,- 특별활동재능기부, 생태현장학습차량, 찾아가는 그림자놀이,· 유모차 소독기 설치 및 관리,· 어린이복합문화시설 '점프' 건립 업무,- 컨텐츠 공모 기획 및 구성,- 설계 및 공사 진행·관리 등,· 보육행정 행사 기획,· 국공립어린이집 시설 및 운영 관리,-화재안전/내진성능보강,-정원조정,-국공립어린이집연합회 지원,· 시간선택제임기제 급여 등,․ 보육지원예산 및 국비보조사업 총괄,․ 보육료 예탁 관리,․ 국공립어린이집 보조금 지원,․ 장애아전문(통합)어린이집 지원사업,․ 보조(연장)교사 및 보육도우미 지원사업,․ 구 자체 사업,․ 업무계획 및 의회자료 관리,․ 기타 팀내 타직원에 속하지 않은 사항,․ 시비보조 사업(예산) 총괄,․ 민간·가정·직장어린이집 인가 및 보조금 지원,․ 민간·가정어린이집 기능보강 사업,․ 서울시 신규사업,․ 어린이집 놀이시설 안전점검 관련업무,․ 민간·가정어린이집 인가 및 보조금 지원,․ 국공립 전환 어린이집 보조금 지원(전체),․ 시간제 어린이집 지원사업,․ 공기청정기 지원사업,․ 서울시 교사대 아동비율 지원사업,․ 어린이집 배상·상해보험료 지원,․ 민간·가정어린이집 환경개선사업(구비),․ 직접채용 대체 및 서울형 전임교사 지원사업,․ 보육전산관리(보육포털사이트 포함),․ 보육료 지원자격 업무 총괄,· 민간·가정어린이집 인가 및 보조금 지원,· 교재교구비 지원사업,· 보육교직원 경력·재직증명서 발급,안심출산 업무 총괄,· 건강가정기본계획 수립,· 저출산 극복 종합계획 수립,· 노원구가족센터(다문화) 위탁운영 및 관리,· 다자녀가정 지원사업(다자녀가정 지원품 및 다둥이행복카드),· 한부모시설 운영지원 및 지도점검,· 저소득 한부모가족 지원사업,· 육아지원코디네이터 운영 지원 업무,· 아이돌봄 지원 사업,· 서울형 아이돌붐,· 결혼중개업 지도점검,· 엄마아빠행복 프로젝트(서울키즈 오케이존,,가사서비스 지원),·『노원 아이편한택시』운영,· 아동수당 지급 및 대상자 결정·관리,· 첫만남이용권 지원,· 서울시 임산부 교통비 지원 사업,· 엄마‧아빠 육아휴직장려금 지원사업,· 가정양육수당 지급 및 대상자 결정·관리,· 부모급여 지급 및 대상자 결정·관리,· 행복출산 원스톱서비스 및 우리아이복지플래너,· 결혼식장 지도·점검(코로나19),· 청소년부모 아동양육비 지원사업"
아동청소년과,"◦ 청소년복지 업무 총괄,◦ 청소년정책에 관한 기본계획 수립 및 추진,◦ 위기청소년 실태조사(청소년안전망 사업),◦ 청소년안전망사업 전담,◦ 청소년안전망 통합지원센터 운영,◦ 청소년안전망 중장기운영계획 수립,◦ 청소년정책협의회 청소년안전망분과 운영,◦ 청소년안전망사업 평가 및 점검,◦ 필수연계기관 및 지역유지기관 관리,◦ 청소년복지 심의위원회 및 실무위원회 운영,◦ 청소년안전망 긴급대응체계 마련,◦ 노원구청소년상담복지센터 운영 지원,◦ 노원청소년성상담센터 운영 지원,◦ 청소년복지팀 예산편성 및 주요업무계획,◦ 청소년시설 지도·점검 계획 추진,◦ 상계청소년문화의집 운영 지원,◦ 청소년운영위원회 및 청소년지도사 배치지원 사업,◦ 청소년아지트(미트업, 미트온, 차오름) 시설 운영 지원,◦ 숙박형 등 청소년활동 사전 신고 처리,◦ 노원청소년 퓨처로드사업 추진, 시립노원청소년미래진로센터 지원,◦ 청소년정책협의회 청소년정책분과 및 청소년문화분과 운영,◦ 상상이룸센터 운영지원(청소년기자단 포함),◦ 공릉청소년문화의집 운영 지원,◦ 청소년이 기획하는 청소년축제 운영,◦ 노해근린공원 청소년아지트 조성,◦ 상계3.4동 청소년문화시설 건립(청소년시설 확충),◦ 노원형 아동·청소년친화도시 협력,◦ 시립노원청소년센터 지원,◦(하쿠나마타타, 오락실, 끌림, 엔터아지트) 시설운영 지원,◦ 청소년정책협의회 청소년참여분과 운영,◦ 뉴딜일자리사업 추진, 시설 종사자 워크숍 추진, 청소년증 발급 관리,◦ 청소년 관련 비영리법인․단체관리,◦ 학교밖청소년지원센터 운영 지원,◦ 대안교육 위탁교육기관 운영 지원(3개 학교),◦ 학교폭력예방청소년지원사업,◦ 청소년보호 단속활동 및 지원,◦ 청소년 유해환경 점검·단속 및 유해환경감시단 지원,◦ 청소년지도협의회·청소년육성회 지원 관리,◦ 쉼터 퇴소청소년 자립지원수당 지급,◦ 청소년안전망 홍보(기념품, 인쇄물 등),◦ 청소년안전망 통합지원센터 예산집행,○청소년안전망 사례관리,◦ 위기청소년 발굴 연계망 구축(아동보호전문기관,드림스타트,주민센터),◦ 청소년복지 심의위원회 및 실무위원회 실무,◦ 청소년안전망 정기회의 운영, 위기청소년 맞춤형 지원 운영,◦ 긴급지원비 운영 및 관리, 청소년안전망 긴급대응체계 마련 지원,◦ 청소년안전망 직접사업 운영, 사례관리(서비스 지원 및 사후관리),의료급여기금특별회계, 의료급여관리사 인사관리, 의료급여비용 사후관리 및 부당이득금 환수 등,○ 아동 청소년 ․ 친화도시 활성화 총괄 지원,○ 유니세프 아동친화도시 인증과 이행 구성요소 ( 1~9),- 조성전략 수립 및 실행과제 이행 점검 ․ 보고,- 아동 친화적인 법체계,- 아동실태보고 아동영향평가 연구용역 ,,○ 아동권리 옴부즈퍼슨 및 모니터링단 운영,○ 아동정책조정협의회 운영,○ 아동권리 교육 및 홍보,○ 아동청소년친화도시추진위원회 운영,○ 구청장배 아동청소년스포츠 대회,○ 온종일 돌봄 생태계 구축 총괄 지원,○ 아이휴센터 운영 및 관리,- 아이휴센터 신규 조성,- · 아이휴센터 매입 전세계약 업무,- ( 아이휴센터 예산 설치비),○ 노원구 온종일돌봄위원회 운영,○ 노원구 온종일돌봄사업단 지원 업무,○ 우리키움참여단 및 마을돌봄협의회 운영 지원,○ 방과후교실 지원 및 관리,: 행사추진 돌봄종사자 워크숍,○ 지역아동센터 지원 및 관리 총괄,- 지역아동센터 운영 보조금 지원,- 지역아동센터 운영 지원( 15 / 8 ) 구립위탁 개소 민간 개소,- 지역아동센터 서울시 보고자료작성,(지역아동센터 운영현황 긴급일시돌봄 , ) 등,○ 노원구지역아동센터협의회 지원,: 행사지원 지역아동센터 연합행사,○ 지역아동센터 시설 관리,- 지역아동센터 시설 예산,○ 아동복지시설 사회복무요원 관리,○ 임기제공무원 보수 지급,아픈아이돌봄센터 운영,○ 노원형 돌봄 2.0 플러스 추진,- 밥상돌봄 아동식당 조성 및 운영,- ( 아픈아이돌봄 운영 돌봄센터 병원동행서비스 , ),○ 아동복지교사 및 아동돌봄교사 지원사업 업무,○ 기간제 근로자 보수 지급,○ 유니세프 아동친화도시 인증과 이행 구성요소 ( 3,5,6),- 아동 안전 및 아동보호구역 지정운영 ․ 관리,- 나도 건축가 운영,○ 아동친화도시 지방정부협의회 업무,○ 지역기반형 교육복지특별지원사업,○ 서울시 아동친화 특화사업 추진,○ 노원 아동홈페이지 관리 오청아한 ( 톡톡 운영 관리 ․ ),○ 아동청소년참여위원회 운영,○ 아동청소년참여예산 운영,지역사회 돌봄 필요아동 발굴 및 연계,◽드림스타트 예산 총괄,◽아동통합사례관리 운영 및 행복e음 관리,(사례배정, 선정, 종결, 회의 등),◽드림스타트 슈퍼비전 및 역량강화교육,◽드림스타트 사업 평가,◽드림스타트 운영위원회 및 아동복지기관협의체 운영,◽아동통합사례관리사 관리(채용, 평가, 인건비 등),◽아동복지관 시간선택제 임기제 공무원 관리,◽드림스타트 필수서비스 운영,◽드림스타트 맞춤서비스 운영,◽드림스타트 예방서비스 운영,◽드림스타트 홍보 및 홈페이지 관리,◽자원관리(행복e음등록 포함) 및 후원물품관리,◽저소득 취약계층 아동발굴 및 전수조사,◽드림스타트 공공운영비 집행 및 관리,◽드림스타트 물품구매 및 관리,◽행사–종사자 워크숍, 가족소풍,◽모범 청소년 표창,◽지역사회서비스투자사업 업무(노원구 총괄),◽지역사회서비스투자사업 평가 및 점검,◽지역사회서비스투자사업 제공기관 등록, 관리 및 점검,◽지역사회서비스투자사업 대상자 관리(재판정 등),◽노원아동복지관 리모델링 하자·시설 보수,◽노원아동복지관 용역비 및 공공요금 관리(상시),◽노원아동복지관 당직 관리,◽청소년 건강지원 사업(여성청소년 위생물품),◽결식아동급식 지원사업,◽결식아동급식 단체급식소 위생·회계 점검,◽노원구 결식아동급식 위원회 운영,◽꿈나무카드 가맹점 발굴 및 관리,(신규가맹점 등록 및 부적합업소 선별 등),◽지역사회 상생급식 시범사업,◽드림스타트 자원봉사자 관리,◽청소년 특별지원 사업,◽노원아동복지관 운영 총괄,◽노원아동복지관 뉴딜일자리 관리, 교육 및 공공일자리 관리,◽노원아동복지관 내 도서관 및 민간기관 운영지원,◽노원아동복지관 전문가협의회, 기관운영위원회 운영,◽노원아동복지관 보안 및 시설 관리,◽노원아동복지관 외부 유관기관 협력,◽노원아동복지관 아동전용공간 운영 총괄관리,◽노원아동복지관 아동전용공간 프로그램 기획 및 관리,◽노원아동복지관 아동전용공간 운영위원회 구성 및 운영,◽아동통합사례관리 – C, E권역,◽맞춤서비스 – 찾아가는아동발달놀이상담, 맞춤코칭,◽신규 아동통합사례관리사 교육 및 내부 슈퍼바이저,◽종사자역량강화교육,◽행사-가족소풍,◽아동통합사례관리 – D, E권역,◽맞춤서비스 – 학습지지원, 영유아발달스크리닝,◽사례관리슈퍼비전,◽행사-가족의 밤,◽아동통합사례관리 – A, B권역,◽사례관리 총괄,◽맞춤서비스 – 개별치료지원,◽행사-부모힐링의 날,◽아동통합사례관리 – A, D권역,◽맞춤서비스 – 기초학습교실, 발달검사 및 진단,◽행사-종사자워크샵,◽아동통합사례관리 – B, C권역,◽맞춤서비스 – 맞춤형 모-아 프로그램, 긴급일시지원, 주거환경개선,○ 아동학대전담공무원 및 업무 총괄(신고접수·현장조사·응급조치 등),○ 아동학대예방협의체 운영(아동학대 정보연계 협의체 운영),○ 서울형 아동학대 판단회의 운영,○ 아동학대전담공무원 및 업무(신고접수·현장조사·응급조치 등),○ 아동학대예방 캠페인 및 홍보(홈페이지 등 총괄,○ 정책 및 기획보고 총괄,◦ 아동학대 조사원(신고접수·현장조사·응급조치 등),◦ 위기아동발굴시스템 업무,- 아동학대 전담공무원,- 아동학대예방 교육 및 신고의무자 교육,○ 아동학대 전담공무원(신고접수·현장조사·응급조치 등),○ 자원봉사자 구성 및 관리(전문자원봉사자 모집 및 운영),○ 아동학대예방 캠페인 및 홍보(노원구아동보호전문기관 홈페이지 운영 등),- 아동학대전담공무원,- 영유아 학대피해아동 아동보호시설(다예) 관리,- 학대피해아동 쉼터(오유)관리,○ 아동보호전문기관 예산 및 회계처리,○ 아동학대 사례관리 상담원 보수지급 등,○ 뉴딜청년일자리사업(노무관리 포함),○ 학대피해아동 사례관리업무 총괄,○ 노원구아동보호전문기관 협력체계 구축 및 연계,○ 상담원 역량강화교육 및 슈퍼비젼 진행,○ 임시조치 및 보호처분 이행관리,○ 가족지원사업(부모교육, 가족체험프로그램등) 총괄,○ 외부지원사업,○ 학대피해아동 및 가정 사례관리,○ 보호처분 이행관리, 피해아동 가정 사후관리,○ 가족지원사업(부모교육, 가족체험프로그램등)진행,○ 외부지원사업(방문형사업,신한솔공모사업 등) 실무,○ 국가시스템 담당자 지정 및 총괄,○ 방문형가정회복사업 예산 집행,◦ 학대피해아동 및 가정 사례관리,◦ 보호처분 이행관리, 피해아동 가정 사후관리,◦ 가족지원사업(부모교육, 가족체험프로그램),◦ 외부지원사업(방문형사업,신한솔공모사업) 실무,학대피해아동 및 가정 사례관리,○ 학대피해아동 심리치료,○ 학대행위자 상담 및 교육,○ 학대피헤아동 가족 심리지원,○ 외부지원사업(방문형사업,신한솔공모사업 등) 지원,○ 아동복지시설 지원·점검(양육시설, 공동생활가정),○ 아동복지심의위원회 및 사례결정위원회 운영,○ 복지대상자 지원금(생계급여, 가정위탁아동, 입양아동, 보호종료아동 지원금),○ 아동발달지원계좌(디딤씨앗통장) 운영,○ 아동보호전담요원 보수지급 등,○ 직원역량강화 총괄,○ 아동양육시설(성모자애드림힐) 보호아동 총괄,(양육상황점검, 면접교섭, 보호종료·퇴소 등),○ 시설입소아동 입양 및 무연고아동 행정처리,○ 보호아동 면접교섭지원 총괄,○ 보호종료아동 사후관리 총괄,○ 시설 자립준비청년 자립지원상담 및 사후관리,○ 보호아동 원가정복귀프로그램 운영,○ ①보호대상아동(신규) 보호조치에 관한 사항,(상담, 가정환경조사, 보호계획수립 등),○ 가정위탁아동 관리·지원 총괄,(양육상황점검, 면접교섭, 보호종료 등),○ 가정위탁 자립준비청년 자립지원상담 및 사후관리,○ 보호대상아동 자격취득비, 언제든 두드려요 노원 사업 운영,○ 아동위원협의회, 자립준비청년 보호·지원 협의체,○ 아동보호전담요원 사업 운영(사업비집행) 총괄,○ 전문멘토(언제든 기댈 수 있는 어른)사업 운영,○ 공동생활가정(하늬네·가온나래·테바) 총괄"
교육지원과,"수학문화관 업무 총괄,노원과학영재교육원 운영,미래인재양성 교육특구사업 운영,서울형 혁신교육지원사업 총괄,- 인사 관리, 직원복무 및 당직근무 운영,- 예산·결산, 회계, 물품 및 일상경비에 관한 사항,- 운영위원회 운영,-문서접수, 기록물 관리, 직인관리,- 시설물 운영 관리 총괄(전기, 통신, 기계, 보안 전반),- 트라이 교구판매숍 운영 관리,- 주차장 운영 관리,- 영조물 손해보험에 관한 사항,- 기획사업 운영,- 영화관( 시네마) 운영 관리,- 시설임대 및 대관업무,- 수학 해설사 운영,- 초, 중, 고 단체 관람 운영,- 특별 강연 및 수학 행사 운영,- 자원봉사자 운영,- 전시실 콘텐츠 유지 보수,- 2층 전시실 담당,노원혁신교육지원센터 업무 및 사업 총괄,민관학 네트워크 구축 및 운영 총괄,청소년 자치활동강화,심리정서지원사업 운영,학교분과 운영 관리,학부모참여활동 지원,청소년 진로, 직업 교육 지원,학부모분과 운영 관리,동단위 교육거버넌스 지원 사업 추진,학교내 마을학교 운영,마을 자원연계 학업중단예방사업 운영,마을분과 운영 관리,창의체험버스지원 운영,마을방과후학교 운영,청소년분과 운영 관리,◦도농상생 공공급식 지원 사업,◦동북4구 공공급식 센터 지원 및 관리,◦유치원 무상급식 지원 사업,◦친환경 학교급식 지원,◦학교급식 우수 식재료 공급업체 선정 및 관리,◦교육·홍보사업 및 전통장 지원사업,-학교지원사업 주요계획 수립,-각급학교 교육경비 보조금 지원 총괄,-중학교, 고등학교 교육경비 보조금 지원,◦ 유치원·초등학교 교육경비 보조금 지원,◦ 초·중·고 입학준비금 지원,◦ 학교 체육시설 개방지원 사업,◦ 비영리민간단체 보조금 지원(녹색어머니연합회),○ 노원교육플랫폼 운영 지원,○ 원어민 영어화상학습 운영 등,노원천문우주과학관 운영 지원,어린이 및 청소년 교육사업 지원,역사의길,지구의길 운영 및 관리,노원교육플랫폼 운영 관리,교육(진학, 진로)관련 상담 및 프로그램 운영"
청년정책과,"◦ 노원구 청년정책 발굴 및 활동생태계 조성,◦ 서울청년센터 노원 오랑 운영,◦ 청년아지트 확충 및 운영,◦ 청년축제 개최,◦ 청년참여예산 공모사업 등,노원오랑 운영, 청년포럼,- 청년아지트 확충 및 운영,- 노원 청년 문화살롱(문화예술네트워크),- 노원 공유마켓형 청년 플랫폼 조성,- 공릉 골목상권 청년상가 지원 사업,-데이터 수집 캠페인,-데이터 액티비스트 양성,-노원청년축제,-청년참여예산 공모사업,-청년정책 홍보,청년정책 거버넌스, 공유오피스 운영,청년 창업지원,청년 아웃도어 매니저 양성 사업,청년 일자리 플러스 센터 조성,지역주도형 청년일자리 사업,노원구 청년일자리센터 청년내일 운영지원,취약청년을 위한 청년자립단 운영,팝업스토어 조성 및 운영,노원청년일삶센터 운영, 스터디카페 이용권 지원,20대청년 문화생활비, 도전숙,,취약청년 함께서기 지원사업,여성청년 안전한 내집만들기"
