과,하는일
푸른도시과,"제안검토, 사업계획 수립 등 공원분야 기획,구청장 요청사항 관리 및 타부서 협조업무,부서 물품 및 비품관리,불암산 근린공원 조성 및 관리,불암산 시공원 보수정비사업,장기미집행 및 구역 보상 업무(불암산),불암산 목공예방 조성,불암산 유아숲체험원 조성 및 관리,불암산 위탁 및 점용(행위) 허가 등 관리,초안산․영축산(비석골포함)근린공원 유지관리,장기미집행 및 시공원 보수정비사업,산림 내 자연발효식 화장실 정비 및 유지관리,공무직 등 현장인력 수급 및 근무상황 관리 총괄,공무직, 희망근로 및 공원기획팀 기간제근로자 인건비 지급,공공요금 납부,산업안전보건관리 총괄,초안산(비석골 포함), 영축산 공원관리,수락산, 불암산 현장관리,공원조성팀 업무 전반에 관한 사항,구청장 지시사항 및 주요 단일사업 추진,공원조성계획 및 도시계획 업무,도시공원 재조성 및 신규 조성사업(근린·문화·주제공원),기부채납공원(재개발·재건축) 조성 및 인수,생활공원 재생사업,어린이공원 시설개선 사업,도시공원 재조성 및 신규 조성사업,(어린이공원, 소공원),창의 어린이놀이터 조성사업,공원내 물놀이장 조성사업,제안검토, 사업계획 수립 등 하천조경분야 기획,근린.문화.체육공원(비석골 제외) 유지관리(중계,하계),근린.문화.체육공원(비석골 제외) 정비사업(중계,하계),근린.문화.체육공원(비석골 제외) 점용허가(중계,하계),중계.등나무공원 녹지연결로 조성사업,휴가든 조성 및 유지관리,공원등 유지관리(근린·문화·체육·어린이·소공원),공원등 신설 및 개량공사(공원조성, 공원관리팀 소관),공원녹지 CCTV 설치 및 유지관리,먹는물터 관리 (수질검사, 심정청소 및 유지관리),근린․문화․체육공원(비석골 제외) 유지관리(상계·월계·공릉),근린․문화․체육공원(비석골 제외) 정비사업(상계·월계·공릉),근린․문화․체육공원(비석골 제외) 점용허가(상계·월계·공릉),공원 내 잔디마당 유지관리 공사,공원 내 폐기물처리용역 및 관리,어린이공원·소공원 유지관리 및 정비사업(상계, 월계),어린이공원·소공원 점용허가(상계, 월계),물놀이장 운영, 공원 내 수경시설 유지관리,(상계,월계) 총괄,공원내 노후 화장실 개선사업,공원 내 화장실, 비상벨 현황 및 관리,어린이공원 경로당 위탁관리,어린이공원·소공원 유지관리 및 정비사업(중계,하계,공릉),어린이공원·소공원 점용허가(중계,하계,공릉),(중계,하계,공릉) 총괄,공원관리팀 물품 및 인력(기간제근로자, 공공근로 등) 관리,도시공원(상계, 월계) 현장관리 및 순찰단속,공원 모래소독 현장관리 및 차량 운전,공원 내 화장실, 비상벨 현황 관리 및 정비 협조,공원녹지분야 시‧구 공동협력사업 협조,공원 현장순찰 및 민원처리,- 금연구역 단속업무,도시계획시설 지정. 해체 관련,개발사업, 건축허가 등 조경협의(단지조경, 시설녹지),녹지(시설, 일반) 조성 및 관리,서울시 경춘선숲길 관련 협의,아파트 열린녹지 조성 및 유지관리,공공기관 담장 개방 및 녹화,시.구 공동협력사업(인센티브) 총괄,가로수・ 띠녹지 조성 및 유지관리,가로수 생육환경 개선사업,지정보호수 및 보호수 쉼터관리,재건축 공동주택 관련 기부채납 협의(가로수, 띠녹지),보도 상의 벤치 관리,가로화분 교체설치 / 수경시설 유지관리,화장실 유지관리/ 나무돌보미 사업,조경팀 인건비 지급 및 4대보험 등 업무처리,조경팀 행정차량 관리,옥상녹화. 텃밭조성사업,마을마당 정비 및 유지관리,자투리땅 조성 및 유지관리,도시구조물 벽면 녹화사업 조성 및 유지관리,도시녹화(녹지활용계약 쉼터) 조성사업,수목식재 사후관리,골목길 조성 및 유지관리,시민녹화 코디네이터 운영,꽃과 정원의 도시, 노원 추진,가로공원 조성 및 관리,시민주도 도시녹화 주민제안사업,에코스쿨 조성사업(도시소생태계 조성),스마트가든 조성,공공건축물 실내정원 조성사업,석계역 문화공원 유지관리,푸른도시 서울상 콘테스트 공모,조경팀 물품 구매,조경팀 가로녹지대 현장 유지관리 및 순찰,(마을마당, 공공공지, 녹지, 띠녹지, 자투리땅 등),공무직, 기간제 등 현장근로자 복무관리,가로녹지대 현장 물품 및 장비 관리,가로녹지대 현장 유지관리, 작업 지도,(마을마당,공공공지,녹지,띠녹지,자투리땅 등),가로녹지대 현장 인력관리 (공무직 등),가로녹지대 현장 현장민원 처리,자연생태팀 업무 전반,제안, 검토 사업계획 수립 등 자연생태분야 기획,공원녹지분야 공원등 유지관리,공원녹지분야 공원등 신설 및 개량공사,먹는 물 공동시설 관리(심정청소 및 유지관리),산림관리(상계3․4동),- 소관구역내 각종 행위허가(신고)처리 및 협의,- 불법사항 단속 및 조치,상계동 철쭉동산 시설개선 및 유지관리,산사태 취약지역 관리 및 산사태 예방사업,산림유역관리사업 시설물 유지관리,절개지 안전관리 및 위험시설물 정비,산림 및 임업 통계,산림관리(중계동),불암산 힐링타운 유지관리,(철쭉동산, 순환산책로, 주차장, 힐링가든 등),불암산 힐링타운 시설개선 사업,불암산 힐링타운 반려동물 임시쉼터 조성,산림 위험수목 정비사업,야생생물(멧돼지 등) 관리 및 보호,야생동물 피해예방 사업,산림관리(상계 9동),- 소관구역 내 각종 행위허가 처리 및 협의,산림병해충 예찰 및 방제사업,생활권 수목진료 민간컨설팅,토착수종 식재 및 도시숲 복원사업,탄소저감 조림사업,생태경관보전지역 보존 및 관리,노원 둘레길, 등산로 살피미단 운영,수락산, 불암삼 숲가꾸기 사업,수락산 자락길 유지관리,식목인, 육림행사 추진,산림관리(상계1동, 상계5동),산불 예방사업 및 산불감시단 운영,자연생태분야 인건비 지급 및 지역일자리 총괄,산림 내 화장실 시설개선 및 유지관리,수락산, 불암산 치유의 숲길 유지관리,목재생산업(목재수입유통업) 관리,사회복무요원 관리,산림병해충 예방 및 방제 및 인력관리,산불전문예방진화대 인력관리,야생조수 구조 현장 민원처리(조류보호협회 인계 등),야생동식물 보호구역 및 숲가꾸기 인력관리,수락산, 불암산 둘레길 및 등산로 유지관리,산림관리(공릉동, 하계동, 중계동, 상계1․3․4․5․9동),치유의 숲길유지관리, 산사태현장예방단 인력관리,불암산힐링타운 유지관리 및 인력관리,목예원(목공소) 유지관리 및 인력관리,하천 녹지 조성 사업,하천 녹지 유지관리,하천 산책로변 특화계단 계절초화 식재,당현천 산책로 전시용역 및 관리,하천녹지 폐기물 처리용역 및 관리,하천 녹지경관 개선 및 지역 명소화 현장 관리,(중랑천, 당현천, 우이천, 묵동천),하천구역(저수호안, 제방, 둔치) 내 수목·초화류,및 자생녹지공간 현장 관리 및 민원 처리,하천조경팀 현장 인력 관리(공무직, 기간제 등),하천조경팀 현장 물품 및 장비 관리,개발제한구역 총괄,- 위법행위 점검 단속 전반,- 개발제한구역 단속계획 수립,- 주민지원사업 계획, 추진,- 향측 판독 전반,개발제한구역업무(상계1,5,9동),- 행위허가(신고)처리 및 협의 전반,- 행정소송, 심판 등 법적 사무 처리,- 위법행위 단속 및 시정계고, 고발조치 등,개발제한구역 지도점검 및 민원처리,개발제한구역 업무처리(상계3.4동),- 행위허가(신고) 처리 및 협의 전반,- 위법행위 단속 및 시정계고, 고발처리 등,개발제한구역 지도점검 및 민원처리(상계3.4동),개발제한구역 분기별 계획 수립,주민지원사업 및 생활비용 보조사업 추진,개발제한구역업무(공릉2동),개발제한구역 지도점검 및 민원처리(공릉2동),각종 대장관리(위법행위, 행위허가, 보존부담금 부과 대장 등),개발제한구역 현장관리 및 단속업무,개발제한구역업무(하계1동, 중계동),개발제한구역 지도점검 및 민원처리(하계1동, 중계동),초소관리 등,개발제한구역 불법행위 관리실태 분기보고 및 각종자료 제출,경춘선 숲길 프리마켓 운영지원"
여가도시과,"불암산 나비정원 및 힐링타운, 정원지원센터, 철쭉제,포천힐링캠핑장, 초안산캠핑장, 더불어숲운영,초안산 도자기체험장 운영, 목예원(목공예체험장, 나무상상놀이터 운영),유아숲, 숲해설, 마들상상놀이터,산림치유센터 총괄,도자기체험장 총괄,불암산나비정원장,나비정원 총괄 운영관리,나비사육, 곤충사육, 식물사육, 전시장관리, 교육프로그램 운영 등,정원지원센터 바리스타,나비정원 운영관리,나비사육, 곤충사육, 전시장관리, 교육프로그램 운영 등,나비정원 운영요원,정원지원센터 카페 운영요원,정원지원센터 운영요원,도자기체험장 운영요원,산림치유센터 운영요원,○ 공공도시텃밭 관리,○ 화랑대 철도공원 기간제근로자 관리,타임뮤지엄 조성 사업 추진,철도미니어처관 조성 사업 추진,경춘선숲길 화랑대 철도공원 조성 추진,화랑대 역사관, 농지업무,화랑대역사관, 기차카페,철도공원유지관리,기차카페 총괄,기차카페 운영요원,도서관 정책 수립 및 조성,스마트도서관,하계어울림센터 관리, 공공도서관 시비보조금 및 세외수입,동네서점 바로 대출, 띵동책배달,책배달 서비스,작은도서관,공유서가 관리, 책읽는노원만들기 추진"
도시경관과,"- 현장 단속업무 총괄,- 특별근무 운영 및 수거물품 행정조치,- 상생위원회,-노점관리,-구바다,-노점 실태조사,-가로판매대, 구두수선대 관리,,-민원사항처리(구바다·응답소) 등,노점운영기금,시선제 급여,노점방지용 화분,가로환경정비(1호차),가로환경정비(2호차),가로환경정비,가로환경정비 (1호차 반장),가로환경정비(2호차 반장),가로환경정비 (3호차 반장),○ 공공디자인 진흥 사업 추진,- 공공디자인 진흥사업 기획 및 추진,○ 공공디자인 가이드라인 및 표준디자인 개발,- 공사장 가림벽 디자인가이드라인 수립 및 운영,- 노원구 공공시설물 표준디자인 개발,○ 공공시설물 등의 공공디자인 협의,- 디자인 검토, 협의 및 모니터링,- 공공디자인진흥사업‧주민자치예산 사업 추진,- 물품(자재) 구매, 설계, 공사계약 및 추진,- 진흥사업 시설 보수, 유지관리 및 공사 민원처리,○ 주민자치예산 사업 추진,- 주민자치예산 사업 설계, 공사, 민원 처리,○ 공공조형물 유지관리,- 공공조형물 보수 및 유지관리,○ 공공디자인, 유니버설디자인, 공공조형물 조례 관리,- 공공디자인진흥위원회, 유니버설디자인위원회,,공공조형물 설치위원회 운영 및 조례관리,○ 주민자치예산사업 추진 등,- 주민자치예산사업 및 주민설명회 등 행사 추진,○ 예산, 회계, 복무 등,- 시간선택임기제 공무원 급여 및 복무관리,-옥외광고 심의위원회,-개별간판 보조금,-광고물 인허가 신고 안전점검 및 민원처리(중계동,하계동),경관개선 연간 계획수립,광고물 관련 법규정비,광고물 허가.신고.안전점검 및 민원처리(중계동,하계동),- 빛공해 관련 업무,- 옥외광고물 안전점검,- 광고물 허가, 신고, 안전점검, 개별간판보조금 지원 및 민원처리(중계, 하계동),- 옥와광고물 안전점검 업무(풍수해, 월별),- 전자게시대(BTO) 업무 총괄,- 전단지 및 가로등 현수기 신고처리,- 광고물 허가 신고 안전점검 및 민원처리(상계1동~상계5동),광고물개선팀장,- 불법유동광고물 정비 민원(상담민원, 응답소 둥),- 지정게시대 순찰 및 정비(기간만료 현수막 등),- 기간제근로자 및 공공근로 임금 등 관리,- 주말 및 야간 단속 근무조 운영 관리,불법광고물순찰,- 불법 고정광고물 행정처분 관리,- 불법 유동광고물 수거보상제,- 위험, 무주간판 등 고정광고물 정비 통제 관리,순찰차량 운전 및 관리, 불법광고물 단속 지원,순찰차량(89더6758)운전 및 관리,불법광모물 단속 지원,불법광고물 순찰3조,불법 고정광고물 정비 및 민원처리"
보건위생과,"구의회·인사·예산 등 협업 추진 업무(국별),일반임기제공무원 채용 및 관리,일상경비집행 및 정산,지역보건의료계획 업무,보건소 청사 및 차량 관리,충무계획 및 보안업무 관리,마들보건지소 건립 업무,보건소 중대재해 관리 지원,민원실 총괄, 민원 접수 및 발급 업무,G4C, 건강진단서 및 건강진단결과서,급여 및 보수수당 관리,보건소 부속실,지역보건의료정보시스템 (PHIS) 권한 부여,정보공개청구 관리,사회복무요원 및 공공근로 관리,민원 접수 및 발급 업무,공공근로 관리,보건소 차량관리(정기검사 및 점검 등),보건소 의료지원 관리,식품접객업 위생관리 총괄,식품위생분야 종합평가 총괄,식품진흥기금,식품접객업 인허가(상계1, 8~9동),원산지표시제 관리 및 정보공개,청소년유해업소 및 야외영업 관리,식품접객업 보수교육 관리 총괄,재난배산책임보험,식품접객업 인허가(상계2동),집단급식소 관리 및 위탁급식업소 관리 총괄,식중독 관련 업무,식품접객업 인허가(중계동),위생지도서비스 및 식품수거(검사의뢰),소비자 식품위생감시원 관리,식품자동판매기,식품접객업 인허가(상계3~7동),모범음식점 및 위생등급제 관리,음식문화개선사업,푸드트럭 총괄,식품접객업 인허가(공릉동),무신고업소 적발 및 고발,세외수입 징수결의,식품접객업 인허가(월계동, 하계동),식품제조•가공업소 등 신고 및 민원처리, 행정처분 , 공유주방업 등록업무,위생용품업 인·허가, 점검 및 행정처분,먹는물 업무(냉온수기신고, 유통샘물수거등),식품 수거검사,시니어감시원 위촉‧운영,어린이급식관리지원센터 설치‧운영,어린이식생활 안전‧영양수준 평가,축산물위생업, 공중위생업,건강기능식품판매업 신고처리, 점검 및 행정처분,즉석판매제조가공업 신고처리, 점검 및 행정처분,어린이 식생활안전관리에 관한 사항,학부모식품안전지킴이 위촉·운영,동물복지사업 계획 수립 및 시행,반려동물 문화센터 운영 및 교육,반려동물 문화축제,취약계층 반려가구 지원 사업,반려동물놀이터 설치 및 관리,길고양이 중성화(TNR) 사업,길고양이 계류장 관리 운영,유기동물보호소 및 유기동물 관리,반려견 배변봉투함 설치관리,유기동물 입양비 지원,가축전염병 예방, 방역 계획 수립 및 시행,동물등록제,동물관련업 인허가,민원처리,반려동물 살피미단,동물보호법 위반 단속 및 과태료 부과,각종 동물민원처리 (공릉, 월계, 하계),동물보호명예감시원 활동사항 관리),반려견주 준수사항 등 캠페인 및 홍보활동,동물보호법위반 단속 및 과태료 부과,동물관련 현장민원처리(상계,중계),동물호보명예감시원 활동사항관리"
건강증진과,"찾동 방문 간호,ㆍ지역사회 통합건강증진사업 총괄,ㆍ건강생활지원센터,ㆍ만성질환 FMTP 교육관리,• 노원구 건강관리센터,- 대상자 중심 건강관리 계획 수립,- 만성질환 합병증 및 예방관리,- 약물교육,• 시간선택제 복무관리,• 기간제근로자 복무관리,• 기간제 채용 및 관리,• 노원구 건강관리센터 운영,• 대사증후군관리사업 운영 전반,• 건강관리사업 연계,• 임기제, 공무직, 기간제 인력관리 등,• 영양개선사업 운영 총괄,• 국민영양관리시행 계획 및 평가,• 지역사회통합건강증진사업(영양관리),• 기간제(영양관리, 영양플러스) 인력관리,• 싱겁게 먹는 배움터 사업 운영 총괄,• 지역사회 통합건강증진사업(영양관리) 지원,- 애들아, 과일먹자 사업 운영 지원,- 영양플러스사업 지원,• 영양플러스사업 운영,- 세부계획 수립 및 평가, 대상자 등록 및 관리,- 영양교육 프로그램 운영 및 영양상담,• 심뇌혈관질환 예방관리사업 운영 총괄,• 고혈압,당뇨병 상담 및 교육,• 노원구 건강관리센터 운영관리 전반,• 교육자료 개발 및 건강증진사업 운영지원,*코로나19 대응업무,• 중계 평생 건강관리센터 운영관리 전반,• 중계평생건강관리센터 운영 지원,- 지역주민 건강교육 및 상담,- 대사증후군 추구관리 실적관리,• 노원평생관리센터 운영지원,• 취약계층 찾아가는 건강상담실 운영지원,• 지역주민 영양 상담 및 지도, 프로그램 운영,• 건강도시 추진단, 운영위원회 구성 및 운영,• 건강의제추진(다부문공동),• 노원형 건강도시 계획 수립 및 실행 총괄,- 노원형 건강영향평가 운영,- 건강도시 연차별 모니터링 및 평가,- 건강도시 자문단 구성 및 운영,- 건강도시 국내외 네트워크 활동,• 지역사회통합건강증진(아동청소년건강증진),- 꿈나무 건강상담실 운영 및 가족 프로그램,- 미취학 아동 Let's Play,- 방학특강 건강관리, 홈밀트 프로그램,• 건강한 돌봄놀이터 운영,• 뛰노는 학교, 건강한 학교 설치 및 모니터링,• 찾동 ‧통합 방문건강관리사업 운영 총괄,• 방문인력 관리 및 충원에 관한 사항,• 보건·복지 방문건강관리 네트워크 구축,• 민선7기 전략과제, 노원형 찾동사업,• 정부합동평가, 시-자치구 공동협력사업 평가,• 통합건강증진사업(어르신) 및 지역보건의료계획수립,• 방문건강관리사업 세부 운영관련,- 권역별 사례관리, 업무회의 추진,- 방문인력 중앙 및 자체 역량강화 교육 추진,• 고위험군 폭염‧한파 등 계절별건강관리,• 재가암환자 관리사업,• 방문 및 재가암환자 물품구매 ‧ 관리,• AI.IoT기반 어르신 건강관리 시범사업 총괄,- 계획 및 평가, 대상자 등‧퇴록 관리,- 실적관리, 유튜브 운영관리, 사례회의,• AI.IoT사업운영 기기 관리·구매 등,• 아름다운 인생여행 사업,• 방문간호학생 실습관리,• 방문건강관리사업 운영 총괄,• 지역보건의료계획 수립 및 평가(4개년 및 연차별),• 통합건강증진사업(어르신 분야) 수립 및 평가,• 정부합동평가 관련 업무,• 방문인력 관리,• 방문차량 관리,• 방문 구강건강관리,• 월계1동 방문건강관리 업무,- 방문계획서 수립 및 평가,- 65세이상 어르신, 건강취약계층 건강관리,- 건강평가 ,상담, 보건교육, 자원연계,,사례관리 건강프로그램 운영 등,• 월계2동 방문건강관리 업무,• 월계3동 방문건강관리 업무,• 공릉2동 방문건강관리 업무,• 하계1동 방문건강관리 업무,• 하계2동 방문건강관리 업무,• 중계본동 방문건강관리 업무,• 중계1동 방문건강관리 업무,• 중계2,3동 방문건강관리 업무,• 중계4동 방문건강관리 업무,• 상계1동 방문건강관리 업무,• 상계2동 방문건강관리 업무,• 상계3.4동 방문건강관리 업무,• 상계5동 방문건강관리 업무,• 상계6.7동 방문건강관리사업,• 상계8동 방문건강관리 업무,• 상계10동 방문건강관리 업무,• 공릉1동 방문건강관리 업무,• 중계2.3동 방문건강관리 업무,• 상계6.7동 방문건강관리 업무,• 상계9동 방문건강관리 업무,• 건강평가, 케어플랜 수립,- 건강돌봄 대상자 관리,• 전문 영역별 케어서비스,- 모니터링 결과관리 및 조정, 사례회의,• 지역의사회, 병원 등 네트워크 구축,• 건강돌봄서비스(어르신건강동행) 사업,• 재택의료서비스 사업,• 기간제 인력 채용 및 관리,• 아토피·천식 예방관리 사업,• 지역사회 건강조사,• 지역사회 간호학 현장실습 운영"
