과,하는일
재산세과,"• 납세자 보호 관련 업무,• 모범납세자,선정대리인,마을세무사,• 세입 현계,• 수납,• 조례,의회,예산 등,• 과오납 환급(안내문자:02-2116-3556),• 월계2동,월계3동 재산세 및 취득세 부과,감액,감면,비과세처리 등,• 공릉2동 재산세 및 취득세 부과,감액,감면,비과세처리 등,• 재산세총괄,• 월계1동 재산세 및 취득세 부과,감액,감면,비과세처리 등,• 중계본동 재산세 및 취득세 부과,감액,감면,비과세처리 등,• 공릉1동 재산세 및 취득세 부과,감액,감면,비과세처리 등,• 하계1,2동 재산세 및 취득세 부과,감액,감면,비과세처리 등,• 재산조회,• 상계2동,중계1동 재산세 및 취득세 부과,감액,감면,비과세처리 등,• 지역자원시설세 총괄,• 중계2.3동,중계4동 재산세 및 취득세 부과,감액,감면,비과세처리 등,• 취득세 총괄,• 등록면허세(등록) 총괄,• 상계3.4동 재산세 및 취득세 부과,감액,감면,비과세처리 등,• 상계1동 재산세 및 취득세 부과, 감액, 감면,• 상계6.7동,상계9동 재산세 및 취득세 부과,감액,감면,비과세처리 등,• 법인의 제세기본 계획 수립,• 법인 취득세,재산세,• 중계동,하계동 담당 - 법인세무조사,관리,이의신청 등,• 법인 지방세 서면(인터넷)신고 총괄,• 월계동,공릉동 담당 - 법인세무조사,관리,이의신청 등,• 상계동,기타동 담당 - 법인세무조사,관리,이의신청 등,• 개별주택가격 조사 정기분 총괄,• 주택가격조사(하계동,상계동),• 주택가격 예산,• 토지(잠정)등급 확인,• 개별주택가격 조사 수시분 총괄,• 주택가격조사(월계동,공릉동,중계동),• 표준주택, 주택가격 전산,• 시가표준액 총괄,• 공동주택가격 업무"
지방소득세과,"하계동 지방소득세 부과징수,상계동 지방소득세부과징수,지방소득세 특별징수,중계동 지방소득세 부과징수,월계동 지방소득세 부과징수,공릉동 지방소득세부과징수,자동차세 수시분, 감면,차량취득세 수시분 총괄,자동차세 정기분, 비과세, 연납,차량취득세 신고납부,차량 취득세 신고납부,주민세, 면허세(월계, 공릉),주민세, 면허세(하계, 중계),주민세, 면허세(상계)"
부동산정보과,"•부동산중개업 민원 처리【담당동 : 월계동, 공릉동】,- 부동산중개사무소 지도·점검, 행정처분, 소송업무,•토지거래허가제 운영,•부동산 전·월세 거래신고제 업무,•부동산중개사무소 지도·점검, 행정처분, 소송업무,•부동산중개업 민원처리(개설, 이전)【상계동, 둥계동, 하계동】,•부동산중개업 종사자 교육 총괄,·개업공인중개사 연수교육 관리,•함께하는「힐링노원 부동산 소통광장」운영,•부서 SNS 업무 관리(소통담당관),•부동산거래 신고 정밀조사 업무 총괄,•부동산 전·월세 거래신고제 업무 총괄,•부동산거래 지연신고 과태료 부과·징수 관리,•부동산중개사무소 지도·점검,•부동산중개업 민원 처리,- 장소 이전, 폐업, 고용관계, 업무보증 안내,•부동산중개업 종사자 교육(개업공인중개사 연수교육),•부동산중개 및 부동산거래 관련 통계 작성·보고,•부동산거래 신고 정밀조사 업무,∘ 부동산거래 신고 업무(외국인 부동산 취득, 검인 포함),∘ 부동산중개업 즉시민원 처리,∘ 부동산중개업 업무보증 안내,∘ 부동산중개사무소 지도·점검,•팀 업무계획수립 및 회의자료,•지적재조사사업 추진,•지적정보팀 예산 집행에 관한 사항,•부동산행정정보 자료정비,•측량기준점 관리,•토지이동 및 측량성과검사(담당동 : 월계동, 공릉동),•토지이용 효율성 향상을 위한 지적정리(국ㆍ공유지 지적정리 포함),•토지이동 및 측량성과검사【상계동】,•우리 구 재산 찾기 추진,•공유토지분할특례법 운영,•세계측지계 좌표변환 사업 추진,•토지이동 및 측량성과검사【중계동, 하계동】,•지적전산자료 및 정책정보 자료제공,•기타단체 등록번호 부여,•부동산종합공부시스템 등 사용자 권한관리,•토지소유자 정리(등기연계, 신청분),•조상 땅 찾기 창구 운영,•안심상속 원스톱 서비스(사망자재산조회) 처리,•토지소유자 정리,•지적측량 자료관리 시스템 관리,•개발이익 환수에 관한 법률 운영·관리 총괄【공릉동】,•개별공시지가 조사업무 총괄【공릉동】,•부동산가격공시위원회 관리․운영,·심의자료 작성, 위원 위ㆍ해촉,•개별공시지가 예산에 관한 사항,•행정심판, 소송에 관한 사항,•개별공시지가 조사·산정【월계동, 중계동, 하계동】,•부동산가격공시위원회 심의자료 작성,•개발이익 환수에 관한 법률 운영【월계동, 중계동, 하계동】,•개별공시지가 SMS 알림 서비스,•개별공시지가 조사·산정【상계동】,•개별공시지가 전산에 관한 사항,•개발이익 환수에 관한 법률 운영【상계동】,•토지이용계획사항 등 전산자료 정리,•구유재산 매각 예상가격 제공 업무,•민원서류 발급,·토지대장 및 토지이용계획확인서 등 증명발급,•인증기 관리 및 증지수입에 관한 사항,•시군구 전자민원 관리 및 G4C 관련업무,개별공시지가 및 표준지 조사 업무(공릉1동),개별공시지가 전산에 관한 사항(부),부동산가격공시위원회 심의자료 작성,토지이용계획사항 등 전산자료 정리(정),○ 주소정보시설 일제 점검에 관한 업무,○ 건물번호 부여 및 상세주소 관련 업무(상계동),○ 스마트 KAIS 단말기 관리 업무,○ 국가기초구역 및 국가지점번호 관한 사항,○ 건축물대장 등록ㆍ관리(상계동),­ 신규․말소, 표시변경 등 정리,○ 건물통합정보 등록ㆍ갱신,­ 건축물 신규ㆍ말소 변경사항 정리,• 도로명주소 주요 업무계획 수립,• 노원구 주소정보위원회 운영,• 주소정보 부여•변경•폐지에 관한 업무,- 도로명, 사물주소 등의 주소정보 관리,• 건물번호 및 상세주소 관련 업무(중계동),• 주소정보시설 설치 및 유지보수,- 도로명판, 기초번호판, 건물번호판, 사물주소판 등,• 건축물대장 등록•관리(중계동),- 신규•말소, 표시변경 등 정리 및 개별주택가격 관리,•국가주소정보시스템 전산입력 및 운영 등 관리,•개별 도로명주소 고지·고시,•도로명주소 홍보 관련 업무,•건축물대장 등록․관리【공릉동, 하계동】,·신규․말소, 표시변경,•건물번호 부여 및 상세주소 관련 업무【공릉동, 월계동】,•부동산 등기해태 과태료 부과·징수 관리,•공공근로자 관리에 관한 사항,•주소정보관리시스템 전산입력,•건물번호 및 상세주소 부여 신청서 처리[월계동],•상세주소 직권 부여 업무,•건축물대장 위반건축물 및 소유권 변동사항 정리,•건축물대장 등록·관리[월계동],•그린프린팅 센터 운영,○ 그린프린팅 센터 운영(정),<담당구역 : 재정비 2구역·해제3구역>,•상계자력재개발 환지확정처분 및 청산 업무,•환지 등기촉탁 업무,•자력재개발사업 관계법령 질의·해석 등 관련 업무,•환지계획(변경)인가 등 관련 업무,•환지 확정 처분 및 측량 용역 계약·관리·감독 업무,•행정소송 및 행정심판 관련 업무,•구역 내 국·공유지에 관한 사항,•토지소유자 등 권리관계 조사 및 보정,<담당구역 : 재정비 1구역·5구역>,•구역내 국공유지에 관한 사항,•환지조서 및 환지도면, 전산파일 정리 등 관리,•주택사업특별회계 예산에 관한 사항,•환지청산금 징수·교부 관리,•시유지(분양지) 관리,•분양지 매각에 관한 사항,•분양지지정자 소유권 연혁 관리 업무,• 환지청산금 징수·교부 관리,• 환지청산금 체납 관리,• 시유지(분양지) 관리 업무(부),• 분양지 명의변경에 관한 사항,• 분양지 지정자 소유권 연혁 관리 업무,• 환지 등기촉탁 업무"
복지정책과,"-주요업무계획, 간부회의자료 작성,- 감사, 물품관리,- 월간/주간 업무, 부서 사회복무요원 관리,- 충무계획(보건복지, 전시전재민),-복지기획 등 당면현안사항 처리,-1인가구 특별대책, 약자와의 동행사업,-북한이탈주민 운영 지원,-노원교육복지재단 운영 관리,- 복지기획 등 당면현안사항 정리,- 지역사회보장계획 수립,- 동복지평가 총괄,- 재해구호, 의사상자 지원,- 행복e음 교육 및 권한 부여,- 동 주민복지협의회 운영·지원,- 지역사회보장협의체 활성화 방안 수립,- 돌봄노동자 처우개선 관련 업무,- 보훈대상자 수당 지원,- 법률홈닥터, 금융복지상담센터 운영 지원,- 지역복지아카데미(직원 및 주민교육),- 보훈회관 운영 및 지원,- 사회복지시설 종사자 처우개선사업(워크숍, 심리상담지원),- 교육복지재단 파견,노원구 지역사회보장협의체 운영·지원,· 대표/실무협의체, 실무분과 운영,· 분과 공동사업, 민·관 연합사업 등,· 지역사회보장계획 수립 및 모니터링 협업,- 종합사회복지관 운영 관리(9개소),- 이동목욕 사업 대상자 관리,- 희망온돌 따뜻한 겨울나기 사업,- 이웃돕기 자원연계, 협약식 및 전달식,- 저소득층 마스크 보급사업,-종합사회복지관 기능보강사업 및 시설물 안전관리,-사회복지법인·시설 관리시스템 운영,-푸드뱅크마켓센터 운영,-희망마차 위기가정지원,-주민소득 및 생활안정자금 기금 관리,- 이웃돕기 성품접수 지원,- 자원봉사센터 운영 지원,- 복지자원관리시스템 운영(노원복지샘,생복통 관리),- 노원드림희망스터디 사업 담당,- 사회복지시설 사회복무요원 관리,- 서울시 희망두배 청년통장, 꿈나래통장,- 이웃돕기 현금 지원 업무(교육복지재단 연계),-소나무센터(위기가정통합지원센터)운영,-동 단위 및 민관협력 통합사례관리 운영 업무 지원,-희망복지지원단 홍보 및 평가,-통합사례관리사 지원,-기타 통합사례관리업무,- 복지더채움 운영,- 긴급복지지원(총괄),- 긴급지원(중계,하계),- 생활지원비 지급 총괄,-긴급지원(월계, 상계),-긴급지원 심의위원회 안건 상정,-코로나19관련 생활지원비 대상자 조사 및 관리(상계8동),-서울형 긴급지원,-서울희망 SOS 장학금 지원,-저장장애가구 주거환경 개선사업,-복지상담센터(총괄),-긴급지원(공릉),-통합사례관리 실무수행 및 동 주민센터 중간조정,,동복지협의회 참여(하계2동, 중계4동, 상계1동, 상계2동, 상계67동),-동 통합사례관리 모니터링 및 지원,-129이관콜 업무 수행,-소나무센터(위기가정 통합지원센터) 근무,동복지협의회 참여(월계1동,월계2동,월계3동,상계10동),동복지협의회 참여(중계본동,중계1동,중계23동,중계4동),-129 이관콜 업무 수행,-소나무센터(위기가정 통합지원센터) 근무 지원,동복지협의회 참여(상계2동,상계6·7동),동복지협의회 참여(상계3·4동,상계9동,하계2동),동복지협의회 참여(상계1동,상계5동,상계8동),- 어르신/대학생 주거공유(한지붕 세대공감),- 영구,매입,전세임대,- 기존주택 전세임대 즉시지원,- 노원 주거복지센터 업무협조,- 주거급여 총괄,- 지방생활보장위원회 관련업무,- 서울형 주택바우처,- 청년월세 한시 특별지원,- 노원구 소규모 집수리 사업,- 저소득층 에너지효율개선사업,- 서울형 임차보증금 지원사업,- 우리집 에너지컨설팅,- 찾동 기본계획 및 세부계획 수립 및 운영,- 찾동 복지플래너 활동 지원 및 운영,- 노원똑똑똑돌봄단(우리동네돌봄단) 운영,- 그 밖의 찾동관련 업무,- 돌봄SOS센터 총괄,- 돌봄SOS센터 민간거버넌스 운영 관리,- 돌봄매니저 정례회의,- 돌봄SOS센터 모니터링 및 실적관리,- 고독사 예방사업 총괄,- 위기가정(복지사각지대) 발굴 및 지원 총괄,-돌봄SOS센터 교육 운영,-돌봄 사업 홍보,-돌봄서비스 제공 수가 지급,-1인가구 병원 안심동행서비스,-생활복지통합시스템 돌봄SOS센터 권한 관리"
생활복지과,"- 지역자활센터 운영 총괄(노원,남부),- 민간위탁사업(행복나눔빨래방) 관리,- 자활기금 운영 관리,- 지역자활센터(북부) 운영 지원 관리,- 민간위탁사업(행복목욕탕) 관리,- 자활상담사 관리(급여지급 등),- 희망나눔교실 사업,- 조건 미부과자 조건 이행여부 관리,- 직접시행 자활근로사업 운영 지원 관리,- 자활근로사업 예산 관리,- 자활근로 참여자 관리,- 자활지원계획 수립, 상담 및 자활사업 배치,- 조건부수급자 이행여부 관리,- 자산형성 지원사업(통장사업),희망저축계좌1, 2, 청년내일저축계좌,희망키움통장1, 2, 내일키움통장,청년 희망키움통장, 청년저축계좌,- 가사, 간병 방문 지원사업,- 거리노숙인 민원 관리,- 직접시행 자활근로사업 참여자 급여 지급,- 자활근로사업 참여자 4대보험 관리,- 차상위 자활대상자 책정, 관리,- 조건부 수급자 연령 도래자 관리,- 조건부과 유예자, 조건제시 유예자 관리,- 조건 미부과자 조건 이행 여부 관리,- 자활지원계획 수립 및 상담,- 자활사업 배치(게이트웨이),- 국민취업지원제도 참여자 관리 및 연계,- 기초생활보장수급자 업무 총괄,- 기초생활보장수급자 책정,제외,- 보장비용 징수심의 및 관리,- 복지제도 지침 교육 및 업무 추진,- 의료급여기금특별회계 예산편성 및 집행,- 의료급여관리사 인건비 지급 등 인사관리,- 의료급여비용 사후관리 및 부당이득금 환수,- 의료급여 책정, 제외, 자격관리,- 차상위계층 지원사업,- 서울안심소득 시범사업,- 본인부담보상금 /상한제, 과오납 환급,- 입양(대상)아동 의료급여 관리 및 진료비 정산,- 독립유공자 진료증 관리,- 행려환자 의료급여 자격관리,- 임신,출산 진료비 지원,- 기초생활보장급여 예산 총괄,- 기초생활보장 생계, 해산, 장제급여 지원,- 의사무능력자 급여 관리,- 저소득주민 장례영구차 지원,(부정수급자 및 기존 부양의무불이행),- 기초생활보장수급자(생계,의료)변경, 중지,- 부가급여 지급(교육경비, 월동대책비),- 서울형 기초보장제도 책정, 중지, 급여지원,- 부가급여 지급(명절위문금),- 의료급여수급자 건강생활유지비 정산,- 의료급여수급자 진료비 정산(이중자격자),- 정부양곡 할인지원 사업,- 장애인 보조기기 지원,- 저소득주민 건강보험료 지원,- 의료급여수급자 요양비 지원,(복막투석,산소치료,당뇨소모성재료,자가도뇨,인공호흡기,기침유발기,양압기),- 의료급여 사례관리 연간 계획,사례관리 총괄,- 의료급여일사 연장승인업무 총괄,- 상해요인 조사 및 결정(100만원 이상),- 부당의료급여 관련 급여제한여부 결정,- 공릉1동, 상계1동, 상계3,4동, 상계6,7동,(의료급여 연장승인, 의료급여 사례관리,,중복투약자관리,노인틀니 및 임플란트 업무),- 상해요인 조사 및 결정(100만원 미만),- 투여기간 관리 의약품 및 시술관리,치료재료 초과수급자 관리,- 중계2,3동, 중계4동, 중계본동,- 의료급여 장기입원자 사례관리 총괄,- 중복청구진료비 조사 및 결정,- 하계1동, 하계2동, 월계3동,중복투약자 관리,노인틀니 및 임플란트 업무),- 의료급여 신규수급자 사례관리 총괄,- 월계1동, 월계2동, 중계1동, 공릉2동,- 상계2동, 상계5동, 상계8~10동,중복투약자 관리,노인틀니및 임플란트업무),- 복지급여 신청자 선정 및 적정 여부 관리,- 희귀난치성 질환자 보건소 통보,- 복지대상자 민원상담 및 사회복지 일반 업무,- 조사관리(공릉1단지 101~103동, 40~52통),- 복지급여 생성(공릉1동 생계,주거급여),- 생계, 주거급여 소요액 보고,- 통합복지 관련 일반 업무,보장비용 관련 업무,- 조사관리(공릉2동),- 복지급여생성(공릉2동 생계,주거, 기초연금),- 한부모 및 장애인 책정 업무 및 소요액 보고,- 조사관리(월계2동 101~104동, 청백 103~106동, 초안산로2길, 월계로53길),- 복지대상자 신규 책정 사업팀 통보,- 복지급여 생성(월계2동 한부모, 장애인),- 조사관리(월계2동 주공1단지105~107동, 108동,청백101~102동,107~108동, 청백 3,4단지, 주공2단지),- 복지급여 생성(월계2동 생계, 주거),- 근로능력판정 업무 총괄,- 조사관리(상계6,7동),- 복지급여생성(상계6,7동 생계,주거,기초연금),- 조사관리(하계2동),- 복지급여 생성(하계2동 생계, 주거, 기초연금),- 복지대상자 보장중지(변경) 사업팀 통보,- 조사관리(공릉1단지 104~105동, 15~39통),- 복지급여 생성(공릉1동 기초연금),- 공릉1동 근로능력 판정,- 범정부사업 관련 업무,- 조사관리(중계1동, 상계9동 13~14단지),- 복지급여 생성(중계1동),- 서울형기초 및 차상위계층확인 책정 통보,- 조사관리(월계2동 덕릉로,우이천로,기타A,두산위브A,상계9동 보람, 12단지),- 복지급여 생성(상계9동 생계,주거,월계2동 기초연금),- 조사관리(공릉1단지 106~107동, 1~14통),- 복지급여 생성(공릉1동 장애인,한부모, 상계9동 기초연금,장애인, 한부모),- 기초연금 책정, 중지(변경) 통보,소요액 보고,- 복지급여신청자 선정 및 적정 여부 관리,- 복지대상자 민원 상담 및 사회복지 일반 업무,- 조사관리(상10, 중계2,3동 목련308~311동),- 기초연금조사(월계1동 1~5통),- 복지급여 생성(상계10동),- 통합복지 관련 일반업무, 보장비용 관련 업무,- 조사관리(중계2,3동 주공1단지, 일반지역),- 기초연금조사(월계1동 12~17통),- 복지급여 생성(중계2,3동 장애급여,한부모양육비,한부모교육비),- 조사관리(중계2,3동 목련301~303동,무지개),- 기초연금조사(월계1동 6~11통),- 복지급여 생성(중계2,3동 생계,주거급여),- 조사관리(상계8동,중계2,3 목련304~307동),- 기초연금조사(월계1동 18~22통),- 복지급여 생성(상계8동),- 한부모급여 소요액 사업팀 통보,- 조사관리(월계3동 사슴101~104동, 사슴201~203동, 1~20동, 그랑빌,서광),- 복지급여 생성(월계3동 생계,주거급여),- 조사관리(월계3동사슴105~108동,사슴204~205동,3단지,21~39동,성원,일반),- 복지급여 생성(월계3동 장애급여, 기초연금, 한부모양육비, 한부모교육비),- 생계,주거급여 소요액 보고,- 조사관리(상계1동 은빛1~2단지,은빛305~309동, 1~23통),- 복지급여 생성(상계1동 생계,주거급여),- 서울형기초 및 차상위계층확인,타법의료급여 책정 사업팀 통보,- 조사관리(상계1동 은빛301~304동, 두산, 수락리버시티, 24통~47통),- 복지급여 생성(상계1동 장애급여, 기초연금, 한부모양육비, 한부모교육비),- 기초연금 책정, 중지(변경) 사업팀 통보 및 소요액 보고,- 조사관리(월계1동 기초연금조사 제외),- 복지급여 생성(월계1동),- 장애인급여 책정 및 소요액 사업팀 통보,- 조사관리(중계2,3동 목화아파트, 중계그린),- 기초연금 조사(월계1동 23~28통),- 복지급여 생성(중계2,3동 기초연금),- 범정부사업 업무 총괄,- 희귀난치성 질환자, 유급병가 보건소 통보,- 복지대상자 민원상담, 사회복지 일반업무,- 조사관리(상계3,4동 25~26통, 36~45통, 상계2동 기초연금),- 기초연금 조사(하계1동, 중계본동, 중계4동, 상계2동, 상계3,4동, 상계5동),- 복지급여생성(상계3,4동 장애인, 한부모급여),- 조사관리(하계1동 주공904동, 908~912동, 16~25통, 37~41통),- 복지급여 생성(하계1동 생계,주거급여),- 조사관리(상계5동 7~9통,16~21통,29~37통),- 복지급여 생성(상계5동 생계, 주거급여),- 기초연금 책정, 중지(변경) 사업팀 통보,및 소요액 보고,- 조사관리(상계2동, 기초연금 제외),- 복지급여 생성(상계2동 생계, 주거급여,,장애인, 한부모급여),- 한부모가족 업무 총괄,- 조사관리(상계5동 1~6통,10~15통,22~28통),- 복지급여 생성(상계5동 장애인급여, 한부모급여, 기초연금),- 장애인급여(장애인연금)책정, 중지(변경) 사업팀 통보 및 소요액 보고,- 조사관리(중계4동 주공302~304동, 주공206~210동, 주공4단지,,중계본동 1~5통, 11~15통, 21~25통, 33통),- 복지급여 생성(중계4동 생계, 주거급여, 장애인, 한부모급여, 중계본동 기초연금),- 조사관리(하계1동 주공 901~903동, 905~907동, 1~15통),- 복지급여 생성(하계1동 장애인급여, 한부모급여, 기초연금),- 근로능력판정 및 범정부사업 업무 총괄,- 조사관리(중계4동 주공 301동, 305~306동, 주공201~205동, 일반지역, 일반아파트, 중계본동 6~10통, 16~20통, 26~32통),- 복지급여 생성(중계본동 생계, 주거급여, 장애인, 한부모급여, 중계4동 기초연금),- 서울형기초 및 차상위계층확인 업무 총괄,- 조사관리(상계3,4동 1~4통,16~24통,31~35통),- 복지급여 생성(상계3,4동 생계, 주거급여),- 조사관리(상계3,4동 5~15통, 27~30통, 46~52통),- 복지급여 생성(상계3,4동 기초연금, 상계2동 기초연금)"
어르신복지과,"어르신친화도시팀장,○ 주요업무계획 작성,○ 총무일반,부서공익관리,○ 기타 팀업무에 속하지 않은 업무,어르신친화도시 업무계획 총괄,어르신행사 및 효행자 표창,대한노인회 지회 관리,경로당 프로그램 활성화 사업,교통약자를 위한 무료셔틀버스 운영 등,○ 어르신복지협의회 운영,○ 어르신 행사,○ 야간 무더위 쉼터(안전숙소) 운영,○ 노인복지시설 사회복무요원 관리,○ 폭염 및 한파 대책(총괄),○ 장수축하금 지원,○ 교통약자를 위한 무료셔틀버스 운영,경로당 시설,공릉어르신,경로당 운영, 물품지원,주야간, 단기보호, 노인의 집,공릉어르신복지센터, 월계어르신복지센터 운영,장기요양보험 재가급여 납부,서울형 데이케어센터 보조금 지원,재가노인복지시설 및 재가강기요양기관 입소이용 승인,방문요양, 방문목욕,,노인의 집 운영,학대피해노인 일시보호시설 입소 결정 및 운영지원,어르신일자리 사업, 노원시니어클럽 운영 등,기초연금 총괄(공릉, 하계, 상계),기초연금 지급 및 관리(월계, 중계),저소득 어르신 무료급식 지원관리,매화장 자료 관리,정부양곡 지원관리,사회서비스형 어르신일자리,일자리지원센터,구직자, 구인처 전화 및 내방상담,노원50플러스센터 운영 및 관리,어르신 휴센터 운영 및 관리,어르신스포츠센터 운영 및 관리,비영리 민간단체 운영 및 관리,○ 행려, 무연고 사망자 관리,○ 장묘, 장례식장 관리,○ 실버축구단 운영,○ 어르신 청춘극장 운영,○ 노원,공릉,중계,월계 청춘카페 운영"
